{
  "title": "My Reading List",
  "items": [
    "Atomic Habits — James Clear",
    "Deep Work — Cal Newport",
    "The Pragmatic Programmer — Hunt & Thomas",
    "Thinking, Fast and Slow — Daniel Kahneman"
  ],
  "addable": true,
  "removable": true,
  "reorderable": true,
  "placeholder": "Add a book...",
  "appearance": {
    "animation": {
      "entrance": "fade",
      "duration": 300,
      "delay": 0
    },
    "responsive": {
      "padding": {
        "mobile": "16px",
        "tablet": "20px",
        "desktop": "24px"
      }
    }
  }
}
